name,location,hook,villa_location,price,photo,amenities,link_1_label,link_1_url,link_2_label,link_2_url
Villa Bini Mapa,"Binibeca, Menorca",Walk to sandy beach & restaurants in nice village,Walking distance to sandy beach and restaurants in village,"£3,300 per family inc flights",https://www.redorka.com/wp-content/uploads/2022/11/Binibeca-324-06-web-scaled.jpg,"Pool (unheated), Walk to beach, Walk to restaurants",Website,https://www.redorka.com/en/menorca/villa-mapa/,,
Heretat de San Joan,Inland Menorca,"Same place we went to last time, drive to towns & beaches","Inland location, drive required to reach towns and beaches","£2,900 per family inc flights",https://casaruralmenorca.com/wp-content/uploads/2024/09/Heretat-Sant-Joan-31.webp,"Pool (unheated), Large garden, Drive to beach",Website,https://casaruralmenorca.com/en/pre-booking/,,
Villa Gerani,"Porto Rafael, Sardinia",Heated pool in lovely village with restaurants & nice beach,In village with walking distance to beach and restaurants,"£3,300 per family inc flights",https://a0.muscache.com/im/pictures/hosting/Hosting-U3RheVN1cHBseUxpc3Rpbmc6MTA3NTM4MjIyNDE0NzEyODAyOA%3D%3D/original/4238a4d1-992c-44ec-98ee-aa778af69501.jpeg?im_w=1200,"Pool (heated), Walk to beach, Walk to restaurants",Website,https://villa-gerani.com/en.html,Airbnb,https://www.airbnb.co.uk/rooms/1075382224147128028?adults=6&check_in=2026-05-25&check_out=2026-06-01&children=4&location=Sardinia%2C%20Italy&search_mode=regular_search&amenities%5B%5D=7&photo_id=1975550446&source_impression_id=p3_1768347119_P386SDmRQqe0mnQ2&previous_page_section_name=1001&federated_search_id=02b024d9-2fce-4dc9-8a1c-8f0bc4a31cd4
Villa Typha 10,"Outside San Pantaleo, Sardinia","Pool, tennis, football pitch, gym; 10km to beaches",10km drive to beaches,"£3,700 per family inc flights",https://emmavillastore.blob.core.windows.net/villa-typha/villa-typha_foto_fb914.jpg,"Pool (unheated), Tennis court, Football pitch, Gym",Website,https://www.emmavillas.com/en/sardegna/villa-typha-10,,
Dimora del Conicchio,"Capalbio, Tuscany","Pool, tennis, football, table tennis; walk to town, drive to beaches","Walking distance to town, drive required for beaches","£2,400 per family inc flights",https://www.dimoradelconicchio.it/immagini/01.jpg,"Pool, Tennis court, Football pitch, Table tennis, Darts, Table football",Website,https://www.dimoradelconicchio.it/en/index.htm,VRBO (10/10 reviews),https://www.vrbo.com/en-gb/p10048632?chkin=2026-05-25&chkout=2026-06-01&d1=2026-05-25&d2=2026-06-01&startDate=2026-05-25&endDate=2026-06-01&x_pwa=1&rfrr=HSR&pwa_ts=1768432666370&referrerUrl=aHR0cHM6Ly93d3cudnJiby5jb20vSG90ZWwtU2VhcmNo&useRewards=false&adults=10&regionId=86&destination=Italy&destType=BOUNDING_BOX&latLong=41.89332%2C12.482932&bedroom_count_gt=5&amenities_facilities_group=private_pool&property_reviews_group=loved_by_guests&searchId=ddc71e23-1357-41dc-9092-b9fa6b58728d&sort=RECOMMENDED&top_dp=5581&top_cur=GBP&userIntent=&selectedRoomType=33972279&selectedRatePlan=0001b923ad7c9c3d4ceaa5364af62e897029&expediaPropertyId=33972279
Capalbio White Villa,"Capalbio, Tuscany Coast","Big pool, sauna, indoor hot tub; short drive to nice coast",Short drive to coast and beaches,"£3,300 per family inc flights",https://www.sopranovillas.com/wp-content/uploads/2024/07/Capalbio-white-villa-09.jpeg,"Pool (unheated), Sauna, Hot tub (indoors)",Website,https://www.sopranovillas.com/property/capalbio-white-villa-tuscany/,,
La Perla Tra Gli Ulivi,"Nr Etruscan Coast, Tuscany","Pool, cinema room, huge garden, sauna, gym, pool table","Near Etruscan Coast, drive required for beaches","£4,100 per family inc flights",img/la-perla-villa.png,"Pool, Cinema room, Huge garden, Sauna, Gym, Pool table",Website,https://www.emmavillas.com/en/toscana/la-perla-tra-gli-ulivi-12,,
Bastidon,"Hyeres, Provence Coast",Heated pool; 15 min walk to nice beach,15 minute walk to beach,"£2,300 per family inc flights",https://img.provenceholidays.com/1aee300c-b26f-4f56-8ed7-829df319dd00/1440w960c?sig=dcb012ca7bf704b6895f8148538ffc376b99c597029632779a666036dc733ac4,"Pool (heated), Walk to beach",Website,https://www.provenceholidays.com/en/holiday-rental/hyeres-bastidon,,
Le Mas de la Garde,"Nr St Tropez (20 mins inland), Cote D'Azur","Heated pool, tennis court, sauna; 20 mins to coast",20 minute drive to coast and beaches,"£2,900 per family inc flights",https://img.provenceholidays.com/93646f04-14f9-4e55-72e2-5af6f35cda00/1440w960c?sig=017e2ff264b0c08210c64079f90ec85bd4ce0271abdd7c791bcf83945825dc80,"Pool (heated), Tennis court, Sauna",Website,https://www.provenceholidays.com/en/holiday-rental/cote-dazur-french-riviera-le-mas-de-la-garde#location,,